{"hook":"你以為排完命盤就看懂自己了嗎？","thesis":"真正有用的是把結果翻成今天能採取的行動。","cta":"想看完整分析，再進作品實際操作。","scenes":[{"id":"s1","start":0,"end":3,"purpose":"鉤子","visual":"主持人近景＋大字","narration":"你以為排完命盤就看懂自己了嗎？","subtitle":"排盤 ≠ 看懂","assetType":"presenter"},{"id":"s2","start":3,"end":7,"purpose":"問題","visual":"快速切過傳統複雜排盤畫面","narration":"很多工具把一堆名詞丟給你，最後還是不知道要怎麼用。","subtitle":"看得到，卻看不懂","assetType":"product"},{"id":"s3","start":7,"end":12,"purpose":"產品實證","visual":"網站實際操作錄影","narration":"所以重點不是多算幾個欄位，而是把結果翻成人話。","subtitle":"把命盤翻成人話","assetType":"screen-recording"},{"id":"s4","start":12,"end":17,"purpose":"具體價值","visual":"事業與感情建議區域特寫","narration":"像事業、感情，直接告訴你現在該注意什麼。","subtitle":"事業・感情・近期建議","assetType":"product"},{"id":"s5","start":17,"end":22,"purpose":"觀點","visual":"主持人半身，鏡頭微推","narration":"我最在意的就是不要做成每個人都一樣的罐頭答案。","subtitle":"拒絕罐頭答案","assetType":"presenter"},{"id":"s6","start":22,"end":27,"purpose":"證據","visual":"前後結果對照＋重點標記","narration":"同樣是命盤，真正差別在於你能不能看完就知道下一步。","subtitle":"看完，要知道下一步","assetType":"comparison"},{"id":"s7","start":27,"end":32,"purpose":"收尾","visual":"產品畫面與主持人交錯，最後品牌卡","narration":"想看完整分析，再進作品實際操作。","subtitle":"實際操作看看","assetType":"brand"}]}